{
  "$schema": "../governance/work-package-auth.schema.json",
  "schemaVersion": "2",
  "id": "GOV-002",
  "kind": "GOVERNANCE",
  "status": "APPROVED",
  "targetModules": ["governance"],
  "scope": [
    {
      "module": "governance",
      "zones": ["implementation"]
    }
  ],
  "capabilities": [],
  "requiredCCR": [],
  "requiredADR": [],
  "requiredGovernancePrerequisites": ["docs/governance/GOV-001-execution-planning-bootstrap.md"],
  "forbiddenCapabilities": [
    "owner-change",
    "dependency-direction-change",
    "contract-change",
    "state-machine-change",
    "migration",
    "governance-change"
  ]
}
